,dataset_name,sentence_number,sentences
2740,geco,2-1360,"Then  there  is  Mr.s.  Cavendish,  continued  Poirot. "
2741,geco,2-1361,That's  another  who  is  not  telling  all  she  knows! 
2742,geco,2-1362,What  do  you  make  of  her  attitude? 
2743,geco,2-1363,I  don't  know  what  to  make  of  it. 
2744,geco,2-1364,It  seems  inconceivable  that  she  should  be  shielding  Alfred  Inglethorp. 
2745,geco,2-1365,Yet  that  is  what  it  looks  like. 
2746,geco,2-1366,Poirot  nodded  reflectively. 
2747,geco,2-1367,"Yes,  it  is  queer. "
2748,geco,2-1368,"One  thing  is  certain,  she  overheard  a  good  deal  more  of  that  'private  conversation'  than  she  was  willing  to  admit. "
2749,geco,2-1369,And  yet  she  is  the  last  person  one  would  accuse  of  stooping  to  eavesdrop! 
2750,geco,2-1370,Exactly. 
2751,geco,2-1371,One  thing  her  evidence  has  shown  me. 
2752,geco,2-1372,I  made  a  mistake. 
2753,geco,2-1373,Dorcas  was  quite  right. 
2754,geco,2-1374,"The  quarrel  did  take  place  earlier  in  the  afternoon,  about  four  o'clock,  as  she  said. "
2755,geco,2-1375,I  looked  at  him  curiously. 
2756,geco,2-1376,I  had  never  understood  his  insistence  on  that  point. 
2757,geco,2-1377,"Yes,  a  good  deal  that  was  peculiar  came  out  today,  continued  Poirot. "
2758,geco,2-1378,"Dr  Bauerstein,  now,  what  was  he  doing  up  and  dressed  at  that  hour  in  the  morning? "
2759,geco,2-1379,It  is  astonishing  to  me  that  no  one  commented  on  the  fact. 
2760,geco,2-1380,"He  has  insomnia,  I  believe,  I  said  doubtfully. "
2761,geco,2-1381,"Which  is  a  very  good,  or  a  very  bad  explanation,  remarked  Poirot. "
2762,geco,2-1382,"It  covers  everything,  and  explains  nothing. "
2763,geco,2-1383,I  shall  keep  my  eye  on  our  clever  Dr  Bauerstein. 
2764,geco,2-1384,Any  more  faults  to  find  with  the  evidence? 
2765,geco,2-1385,I  inquired  satirically. 
2766,geco,2-1386,"Mon  ami,  replied  Poirot  gravely,  when  you  find  that  people  are  not  telling  you  the  truth...look  out! "
2767,geco,2-1387,"Now,  unless  I  am  much  mistaken,  at  the  inquest  today  only  one...at  most,  two  persons  were  speaking  the  truth  without  reservation  or  subterfuge. "
2768,geco,2-1388,"Oh,  come  now,  Poirot! "
2769,geco,2-1389,"I  won't  cite  Lawrence,  or  Mr.s.  Cavendish. "
2770,geco,2-1390,"But  there's  John...and  Miss  Howard,  surely  they  were  speaking  the  truth? "
2771,geco,2-1391,"Both  of  them,  my  friend? "
2772,geco,2-1392,"One,  I  grant  you,  but  both......! "
2773,geco,2-1393,His  words  gave  me  an  unpleasant  shock. 
2774,geco,2-1394,"Miss  Howard's  evidence,  unimportant  as  it  was,  had  been  given  in  such  a  downright  straightforward  manner  that  it  had  never  occurred  to  me  to  doubt  her  sincerity. "
2775,geco,2-1395,"Still,  I  had  a  great  respect  for  Poirot's  sagacity...except  on  the  occasions  when  he  was  what  I  described  to  myself  as  foolishly  pig-headed. "
2776,geco,2-1396,Do  you  really  think  so?  I  asked. 
2777,geco,2-1397,Miss  Howard  had  always  seemed  to  me  so  essentially  honest...almost  uncomfortably  so. 
2778,geco,2-1398,"Poirot  gave  me  a  curious  look,  which  I  could  not  quite  fathom. "
2779,geco,2-1399,"He  seemed  to  speak,  and  then  checked  himself. "
2780,geco,2-1400,"Miss  Murdoch  too,  I  continued,  there's  nothing  untruthful  about  her. "
2781,geco,2-1401,No. 
2782,geco,2-1402,"But  it  was  strange  that  she  never  heard  a  sound,  sleeping  next  door;  whereas  Mr.s.  Cavendish,  in  the  other  wing  of  the  building,  distinctly  heard  the  table  fall. "
2783,geco,2-1403,"Well,  she's  young. "
2784,geco,2-1404,And  she  sleeps  soundly. 
2785,geco,2-1405,"Ah,  yes,  indeed! "
2786,geco,2-1406,"She  must  be  a  famous  sleeper,  that  one! "
2787,geco,2-1407,"I  did  not  quite  like  the  tone  of  his  voice,  but  at  that  moment  a  smart  knock  reached  our  ears,  and  looking  out  of  the  window  we  perceived  the  two  detectives  waiting  for  us  below. "
2788,geco,2-1408,"Poirot  seized  his  hat,  gave  a  ferocious  twist  to  his  moustache,  and,  carefully  brushing  an  imaginary  speck  of  dust  from  his  sleeve,  motioned  me  to  precede  him  down  the  stairs;  there  we  joined  the  detectives  and  set  out  for  Styles. "
2789,geco,2-1409,"I  think  the  appearance  of  the  two  Scotland  Yard  men  was  rather  a  shock...especially  to  John,  though  of  course  after  the  verdict,  he  had  realized  that  it  was  only  a  matter  of  time. "
2790,geco,2-1410,"Still,  the  presence  of  the  detectives  brought  the  truth  home  to  him  more  than  anything  else  could  have  done. "
2791,geco,2-1411,"Poirot  had  conferred  with  Japp  in  a  low  tone  on  the  way  up,  and  it  was  the  latter  functionary  who  requested  that  the  household,  with  the  exception  of  the  servants,  should  be  assembled  together  in  the  drawing-room. "
2792,geco,2-1412,I  realized  the  significance  of  this. 
2793,geco,2-1413,It  was  up  to  Poirot  to  make  his  boast  good. 
2794,geco,2-1414,"Personally,  I  was  not  sanguine. "
2795,geco,2-1415,"Poirot  might  have  excellent  reasons  for  his  belief  in  Inglethorp's  innocence,  but  a  man  of  the  type  of  Summerhaye  would  require  tangible  proofs,  and  these  I  doubted  if  Poirot  could  supply. "
2796,geco,2-1416,"Before  very  long  we  had  all  trooped  into  the  drawing-room,  the  door  of  which  Japp  closed. "
2797,geco,2-1417,Poirot  politely  set  chairs  for  every  one. 
2798,geco,2-1418,The  Scotland  Yard  men  were  the  cynosure  of  all  eyes. 
2799,geco,2-1419,"I  think  that  for  the  first  time  we  realized  that  the  thing  was  not  a  bad  dream,  but  a  tangible  reality. "
2800,geco,2-1420,We  had  read  of  such  things...now  we  ourselves  were  actors  in  the  drama. 
2801,geco,2-1421,"Tomorrow  the  daily  papers,  all  over  England,  would  blazon  out  the  news  in  staring  headlines:  MYSTERIOUS  TRAGEDY  IN  ESSEX  WEALTHY  LADY  POISONED "
2802,geco,2-1422,"There would  be  pictures  of  Styles,  snap-shots  of  The  family  leaving  the  Inquest ...the  village  photographer  had  not  been  idle! "
2803,geco,2-1423,"All  the  things  that  one  had  read  a  hundred  times,  things  that  happen  to  other  people,  not  to  oneself. "
2804,geco,2-1424,"And  now,  in  this  house,  a  murder  had  been  committed. "
2805,geco,2-1425,In  front  of  us  were  the  detectives  in  charge  of  the  case. 
2806,geco,2-1426,The  well-known  glib  phraseology  passed  rapidly  through  my  mind  in  the  interval  before  Poirot  opened  the  proceedings. 
2807,geco,2-1427,I  think  every  one  was  a  little  surprised  that  it  should  be  he  and  not  one  of  the  official  detectives  who  took  the  initiative. 
2808,geco,2-1428,"Mesdames  and  messieurs,  said  Poirot,  bowing  as  though  he  were  a  celebrity  about  to  deliver  a  lecture,  I  have  asked  you  to  come  here  all  together,  for  a  certain  object. "
2809,geco,2-1429,"That  object,  it  concerns  Mr.  Alfred  Inglethorp. "
2810,geco,2-1430,"Inglethorp  was  sitting  a  little  by  himself...I  think,  unconsciously,  every  one  had  drawn  his  chair  slightly  away  from  him...and  he  gave  a  faint  start  as  Poirot  pronounced  his  name. "
2811,geco,2-1431,"Mr.  Inglethorp,  said  Poirot,  addressing  him  directly,  a  very  dark  shadow  is  resting  on  this  house...the  shadow  of  murder. "
2812,geco,2-1432,Inglethorp  shook  his  head  sadly. 
2813,geco,2-1433,"My  poor  wife,  he  murmured. "
2814,geco,2-1434,Poor  Emily! 
2815,geco,2-1435,It  is  terrible. 
2816,geco,2-1436,"I  do  not  think,  monsieur,  said  Poirot  pointedly,  that  you  quite  realize  how  terrible  it  may  be...for  you. "
2817,geco,2-1437,"And  as  Inglethorp  did  not  appear  to  understand,  he  added:  Mr.  Inglethorp,  you  are  standing  in  very  grave  danger. "
2818,geco,2-1438,The  two  detectives  fidgeted. 
2819,geco,2-1439,"I  saw  the  official  caution  Anything  you  say  will  be  used  in  evidence  against  you,  actually  hovering  on  Summerhaye's  lips. "
2820,geco,2-1440,Poirot  went  on. 
2821,geco,2-1441,"Do  you  understand  now,  monsieur? "
2822,geco,2-1442,No;  What  do  you  mean? 
2823,geco,2-1443,"I  mean,  said  Poirot  deliberately,  that  you  are  suspected  of  poisoning  your  wife. "
2824,geco,2-1444,A  little  gasp  ran  round  the  circle  at  this  plain  speaking. 
2825,geco,2-1445,"Good  heavens!  cried  Inglethorp,  starting  up. "
2826,geco,2-1446,What  a  monstrous  idea! 
2827,geco,2-1447,I...poison  my  dearest  Emily! 
2828,geco,2-1448,I  do  not  think ...Poirot  watched  him  narrowly... that  you  quite  realize  the  unfavourable  nature  of  your  evidence  at  the  inquest. 
2829,geco,2-1449,"Mr.  Inglethorp,  knowing  what  I  have  now  told  you,  do  you  still  refuse  to  say  where  you  were  at  six  o'clock  on  Monday  afternoon? "
2830,geco,2-1450,"With  a  groan,  Alfred  Inglethorp  sank  down  again  and  buried  his  face  in  his  hands. "
2831,geco,2-1451,Poirot  approached  and  stood  over  him. 
2832,geco,2-1452,Speak!  he  cried  menacingly. 
2833,geco,2-1453,"With  an  effort,  Inglethorp  raised  his  face  from  his  hands. "
2834,geco,2-1454,"Then,  slowly  and  deliberately,  he  shook  his  head. "
2835,geco,2-1455,You  will  not  speak? 
2836,geco,2-1456,No. 
2837,geco,2-1457,I  do  not  believe  that  anyone  could  be  so  monstrous  as  to  accuse  me  of  what  you  say. 
2838,geco,2-1458,"Poirot  nodded  thoughtfully,  like  a  man  whose  mind  is  made  up. "
2839,geco,2-1459,Soit!  he  said. 
2840,geco,2-1460,Then  I  must  speak  for  you. 
2841,geco,2-1461,Alfred  Inglethorp  sprang  up  again. 
2842,geco,2-1462,You? 
2843,geco,2-1463,How  can  you  speak? 
2844,geco,2-1464,You  do  not  know......  he  broke  off  abruptly. 
2845,geco,2-1465,Poirot  turned  to  face  us. 
2846,geco,2-1466,Mesdames  and  messieurs! 
2847,geco,2-1467,I  speak! 
2848,geco,2-1468,Listen! 
2849,geco,2-1469,"I,  Hercule  Poirot,  affirm  that  the  man  who  entered  the  chemist's  shop,  and  purchased  strychnine  at  six  o'clock  on  Monday  last  was  not  Mr.  Inglethorp,  for  at  six  o'clock  on  that  day  Mr.  Inglethorp  was  escorting  Mr.s.  Raikes  back  to  her  home  from  a  neighbouring  farm. "
2850,geco,2-1470,"I  can  produce  no  less  than  five  witnesses  to  swear  to  having  seen  them  together,  either  at  six  or  just  after  and,  as  you  may  know,  the  Abbey  Farm,  Mr.s.  Raikes's  home,  is  at  least  two  and  a  half  miles  distant  from  the  village. "
2851,geco,2-1471,There  is  absolutely  no  question  as  to  the  alibi! 
2852,geco,3-1,There  was  a  moment's  stupefied  silence. 
2853,geco,3-2,"Japp,  who  was  the  least  surprised  of  any  of  us,  was  the  first  to  speak. "
2854,geco,3-3,"My  word,  he  cried,  you're  the  goods! "
2855,geco,3-4,"And  no  mistake,  Mr.  Poirot! "
2856,geco,3-5,"These  witnesses  of  yours  are  all  right,  I  suppose? "
2857,geco,3-6,Voila! 
2858,geco,3-7,I  have  prepared  a  list  of  them...names  and  addresses. 
2859,geco,3-8,"You  must  see  them,  of  course. "
2860,geco,3-9,But  you  will  find  it  all  right. 
2861,geco,3-10,I'm  sure  of  that. 
2862,geco,3-11,Japp  lowered  his  voice. 
2863,geco,3-12,I'm  much  obliged  to  you. 
2864,geco,3-13,A  pretty  mare's  nest  arresting  him  would  have  been. 
2865,geco,3-14,He  turned  to  Inglethorp. 
2866,geco,3-15,"But,  if  you'll  excuse  me,  sir,  why  couldn't  you  say  all  this  at  the  inquest? "
2867,geco,3-16,"I  will  tell  you  why,  interrupted  Poirot. "
2868,geco,3-17,There  was  a  certain  rumour...... 
2869,geco,3-18,"A most  malicious  and  utterly  untrue  one,  interrupted  Alfred  Inglethorp  in  an  agitated  voice. "
2870,geco,3-19,And  Mr.  Inglethorp  was  anxious  to  have  no  scandal  revived  just  at  present. 
2871,geco,3-20,Am  I  right? 
2872,geco,3-21,Quite  right. 
2873,geco,3-22,Inglethorp  nodded. 
2874,geco,3-23,"With  my  poor  Emily  not  yet  buried,  can  you  wonder  I  was  anxious  that  no  more  lying  rumours  should  be  started. "
2875,geco,3-24,"Between  you  and  me,  sir,  remarked  Japp,  I'd  sooner  have  any  amount  of  rumours  than  be  arrested  for  murder. "
2876,geco,3-25,And  I  venture  to  think  your  poor  lady  would  have  felt  the  same. 
2877,geco,3-26,"And,  if  it  hadn't  been  for  Mr.  Poirot  here,  arrested  you  would  have  been,  as  sure  as  eggs  is  eggs! "
2878,geco,3-27,"I  was  foolish,  no  doubt,  murmured  Inglethorp. "
2879,geco,3-28,"But  you  do  not  know,  inspector,  how  I  have  been  persecuted  and  maligned. "
2880,geco,3-29,And  he  shot  a  baleful  glance  at  Evelyn  Howard. 
2881,geco,3-30,"Now,  sir,  said  Japp,  turning  briskly  to  John,  I  should  like  to  see  the  lady's  bedroom,  please,  and  after  that  I'll  have  a  little  chat  with  the  servants. "
2882,geco,3-31,Don't  you  bother  about  anything. 
2883,geco,3-32,"Mr.  Poirot,  here,  will  show  me  the  way. "
2884,geco,3-33,"As  they  all  went  out  of  the  room,  Poirot  turned  and  made  me  a  sign  to  follow  him  upstairs. "
2885,geco,3-34,"There  he  caught  me  by  the  arm,  and  drew  me  aside. "
2886,geco,3-35,"Quick,  go  to  the  other  wing. "
2887,geco,3-36,Stand  there...just  this  side  of  the  baize  door. 
2888,geco,3-37,Do  not  move  till  I  come. 
2889,geco,3-38,"Then,  turning  rapidly,  he  rejoined  the  two  detectives. "
2890,geco,3-39,"I  followed  his  instructions,  taking  up  my  position  by  the  baize  door,  and  wondering  what  on  earth  lay  behind  the  request. "
2891,geco,3-40,Why  was  I  to  stand  in  this  particular  spot  on  guard? 
2892,geco,3-41,I  looked  thoughtfully  down  the  corridor  in  front  of  me. 
2893,geco,3-42,An  idea  struck  me. 
2894,geco,3-43,"With  the  exception  of  Cynthia  Murdoch's,  every  one's  room  was  in  this  left  wing. "
2895,geco,3-44,Had  that  anything  to  do  with  it? 
2896,geco,3-45,Was  I  to  report  who  came  or  went? 
2897,geco,3-46,I  stood  faithfully  at  my  post. 
2898,geco,3-47,The  minutes  passed. 
2899,geco,3-48,Nobody  came. 
2900,geco,3-49,Nothing  happened. 
2901,geco,3-50,It  must  have  been  quite  twenty  minutes  before  Poirot  rejoined  me. 
2902,geco,3-51,You  have  not  stirred? 
2903,geco,3-52,"No,  I've  stuck  here  like  a  rock. "
2904,geco,3-53,Nothing's  happened. 
2905,geco,3-54,Ah! 
2906,geco,3-55,"Was  he  pleased,  or  disappointed? "
2907,geco,3-56,You've  seen  nothing  at  all? 
2908,geco,3-57,No. 
2909,geco,3-58,But  you  have  probably  heard  something? 
2910,geco,3-59,"A  big  bump...eh,  mon  ami? "
2911,geco,3-60,No. 
2912,geco,3-61,Is  it  possible? 
2913,geco,3-62,"Ah,  but  I  am  vexed  with  myself! "
2914,geco,3-63,I  am  not  usually  clumsy. 
2915,geco,3-64,"I  made  but  a  slight  gesture ...I  know  Poirot's  gestures... with  the  left  hand,  and  over  went  the  table  by  the  bed! "
2916,geco,3-65,He  looked  so  childishly  vexed  and  crest-fallen  that  I  hastened  to  console  him. 
2917,geco,3-66,"Never  mind,  old  chap. "
2918,geco,3-67,What  does  it  matter? 
2919,geco,3-68,Your  triumph  downstairs  excited  you. 
2920,geco,3-69,"I  can  tell  you,  that  was  a  surprise  to  us  all. "
2921,geco,3-70,"There  must  be  more  in  this  affair  of  Inglethorp's  with  Mr.s.  Raikes  than  we  thought,  to  make  him  hold  his  tongue  so  persistently. "
2922,geco,3-71,What  are  you  going  to  do  now? 
2923,geco,3-72,Where  are  the  Scotland  Yard  fellows? 
2924,geco,3-73,Gone  down  to  interview  the  servants. 
2925,geco,3-74,I  showed  them  all  our  exhibits. 
2926,geco,3-75,I  am  disappointed  in  Japp. 
2927,geco,3-76,He  has  no  method! 
2928,geco,3-77,Hullo! 
2929,geco,3-78,"Hullo!  said,  looking  out  of  the  window. "
2930,geco,3-79,Here's  Dr  Bauerstein. 
2931,geco,3-80,"I  believe  you're  right  about  that  man,  Poirot. "
2932,geco,3-81,I  don't  like  him. 
2933,geco,3-82,"He  is  clever,  observed  Poirot  meditatively. "
2934,geco,3-83,"Oh,  clever  as  the  devil! "
2935,geco,3-84,I  must  say  I  was  overjoyed  to  see  him  in  the  plight  he  was  in  on  Tuesday. 
2936,geco,3-85,You  never  saw  such  a  spectacle! 
2937,geco,3-86,And  I  described  the  doctor's  adventure. 
2938,geco,3-87,He  looked  a  regular  scarecrow! 
2939,geco,3-88,Plastered  with  mud  from  head  to  foot. 
2940,geco,3-89,"You  saw  him,  then? "
2941,geco,3-90,Yes. 
2942,geco,3-91,"Of  course,  he  didn't  want  to  come  in...it  was  just  after  dinner...but  Mr.  Inglethorp  insisted. "
2943,geco,3-92,What? 
2944,geco,3-93,Poirot  caught  me  violently  by  the  shoulders. 
2945,geco,3-94,Was  Dr  Bauerstein  here  on  Tuesday  evening? 
2946,geco,3-95,Here? 
2947,geco,3-96,And  you  never  told  me? 
2948,geco,3-97,Why  did  you  not  tell  me? 
2949,geco,3-98,Why? 
2950,geco,3-99,Why? 
2951,geco,3-100,He  appeared  to  be  in  an  absolute  frenzy. 
2952,geco,3-101,"My  dear  Poirot,  I  expostulated,  I  never  thought  it  would  interest  you. "
2953,geco,3-102,I  didn't  know  it  was  of  any  importance. 
2954,geco,3-103,Importance? 
2955,geco,3-104,It  is  of  the  first  importance! 
2956,geco,3-105,So  DrBauerstein  was  here  on  Tuesday  night...the  night  of  the  murder. 
2957,geco,3-106,"Hastings,  do  you  not  see? "
2958,geco,3-107,That  alters  everything...everything! 
2959,geco,3-108,I  had  never  seen  him  so  upset. 
2960,geco,3-109,"Loosening  his  hold  of  me,  he  mechanically  straightened  a  pair  of  candlesticks,  still  murmuring  to  himself:  Yes,  that  alters  everything...everything. "
2961,geco,3-110,Suddenly  he  seemed  to  come  to  a  decision. 
2962,geco,3-111,Allons!  he  said. 
2963,geco,3-112,We  must  act  at  once. 
2964,geco,3-113,Where  is  Mr.  Cavendish? 
2965,geco,3-114,John  was  in  the  smoking-room. 
2966,geco,3-115,Poirot  went  straight  to  him. 
2967,geco,3-116,"Mr.  Cavendish,  I  have  some  important  business  in  Tadminster. "
2968,geco,3-117,A  new  clue. 
2969,geco,3-118,May  I  take  your  motor? 
2970,geco,3-119,"Why,  of  course. "
2971,geco,3-120,Do  you  mean  at  once? 
2972,geco,3-121,If  you  please. 
2973,geco,3-122,"John  rang  the  bell,  and  ordered  round  the  car. "
2974,geco,3-123,"In  another  ten  minutes,  we  were  racing  down  the  park  and  along  the  high  road  to  Tadminster. "
2975,geco,3-124,"Now,  Poirot,  I  remarked  resignedly,  perhaps  you  will  tell  me  what  all  this  is  about? "
2976,geco,3-125,"Well,  mon  ami,  a  good  deal  you  can  guess  for  yourself. "
2977,geco,3-126,"Of  course  you  realize  that,  now  Mr.  Inglethorp  is  out  of  it,  the  whole  position  is  greatly  changed. "
2978,geco,3-127,We  are  face  to  face  with  an  entirely  new  problem. 
2979,geco,3-128,We  know  now  that  there  is  one  person  who  did  not  buy  the  poison. 
2980,geco,3-129,We  have  cleared  away  the  manufactured  clues. 
2981,geco,3-130,Now  for  the  real  ones. 
2982,geco,3-131,"I  have  ascertained  that  anyone  in  the  household,  with  the  exception  of  Mr.s.  Cavendish,  who  was  playing  tennis  with  you,  could  have  personated  Mr.  Inglethorp  on  Monday  evening. "
2983,geco,3-132,"In  the  same  way,  we  have  his  statement  that  he  put  the  coffee  down  in  the  hall. "
2984,geco,3-133,No  one  took  much  notice  of  that  at  the  inquest...but  now  it  has  a  very  different  significance. 
2985,geco,3-134,"We  must  find  out  who  did  take  that  coffee  to  Mr.s.  Inglethorp  eventually,  or  who  passed  through  the  hall  whilst  it  was  standing  there. "
2986,geco,3-135,"From  your  account,  there  are  only  two  people  whom  we  can  positively  say  did  not  go  near  the  coffee...Mr.s.  Cavendish,  and  Mademoiselle  Cynthia. "
2987,geco,3-136,"Yes,  that  is  so. "
2988,geco,3-137,I  felt  an  inexpressible  lightening  of  the  heart. 
2989,geco,3-138,Mary  Cavendish  could  certainly  not  rest  under  suspicion. 
2990,geco,3-139,"In  clearing  Alfred  Inglethorp,  continued  Poirot,  I  have  been  obliged  to  show  my  hand  sooner  than  I  intended. "
2991,geco,3-140,"As  long  as  I  might  be  thought  to  be  pursuing  him,  the  criminal  would  be  off  his  guard. "
2992,geco,3-141,"Now,  he  will  be  doubly  careful. "
2993,geco,3-142,Yes...doubly  careful. 
2994,geco,3-143,He  turned  to  me  abruptly. 
2995,geco,3-144,"Tell  me,  Hastings,  you  yourself...have  you  no  suspicions  of  anybody? "
2996,geco,3-145,I  hesitated. 
2997,geco,3-146,"To  tell  the  truth,  an  idea,  wild  and  extravagant  in  itself,  had  once  or  twice  that  morning  flashed  through  my  brain. "
2998,geco,3-147,"I  had  rejected  it  as  absurd,  nevertheless  it  persisted. "
2999,geco,3-148,"You  couldn't  call  it  a  suspicion,  I  murmured. "
3000,geco,3-149,It's  so  utterly  foolish. 
3001,geco,3-150,"Come  now,  urged  Poirot  encouragingly. "
3002,geco,3-151,Do  not  fear. 
3003,geco,3-152,Speak  your  mind. 
3004,geco,3-153,You  should  always  pay  attention  to  your  instincts. 
3005,geco,3-154,"Well  then,  I  blurted  out,  it's  absurd...but  I  suspect  Miss  Howard  of  not  telling  all  she  knows! "
3006,geco,3-155,Miss  Howard? 
3007,geco,3-156,Yes...you'll  laugh  at  me......  Not  at  all. 
3008,geco,3-157,Why  should  I? 
3009,geco,3-158,"I  can't  help  feeling,  I  continued  blunderingly;  that  we've  rather  left  her  out  of  the  possible  suspects,  simply  on  the  strength  of  her  having  been  away  from  the  place. "
3010,geco,3-159,"But,  after  all,  she  was  only  fifteen  miles  away. "
3011,geco,3-160,A  car  would  do  it  in  half  an  hour. 
3012,geco,3-161,Can  we  say  positively  that  she  was  away  from  Styles  on  the  night  of  the  murder? 
3013,geco,3-162,"Yes,  my  friend,  said  Poirot  unexpectedly,  we  can. "
3014,geco,3-163,One  of  my  first  actions  was  to  ring  up  the  hospital  where  she  was  working. 
3015,geco,3-164,Well? 
3016,geco,3-165,"Well,  I  learnt  that  Miss  Howard  had  been  on  afternoon  duty  on  Tuesday,  and  that...a  convoy  coming  in  unexpectedly...she  had  kindly  offered  to  remain  on  night  duty,  which  offer  was  gratefully  accepted. "
3017,geco,3-166,That  disposes  of  that. 
3018,geco,3-167,"Oh!  I  said,  rather  nonplussed. "
3019,geco,3-168,"Really,  I  continued,  it's  her  extraordinary  vehemence  against  Inglethorp  that  started  me  off  suspecting  her. "
3020,geco,3-169,I  can't  help  feeling  she'd  do  anything  against  him. 
3021,geco,3-170,And  I  had  an  idea  she  might  know  something  about  the  destroying  of  the  will. 
3022,geco,3-171,"She  might  have  burnt  the  new  one,  mistaking  it  for  the  earlier  one  in  his  favour. "
3023,geco,3-172,She  is  so  terribly  bitter  against  him. 
3024,geco,3-173,You  consider  her  vehemence  unnatural? 
3025,geco,3-174,Y...es. 
3026,geco,3-175,She  is  so  very  violent. 
3027,geco,3-176,I  wondered  really  whether  she  is  quite  sane  on  that  point. 
3028,geco,3-177,Poirot  shook  his  head  energetically. 
3029,geco,3-178,"No,  no,  you  are  on  a  wrong  tack  there. "
3030,geco,3-179,There  is  nothing  weak-minded  or  degenerate  about  Miss  Howard. 
3031,geco,3-180,She  is  an  excellent  specimen  of  well-balanced  English  beef  and  brawn. 
3032,geco,3-181,She  is  sanity  itself. 
3033,geco,3-182,Yet  her  hatred  of  Inglethorp  seems  almost  a  mania. 
3034,geco,3-183,"My  idea  was...a  very  ridiculous  one,  no  doubt...that  she  had  intended  to  poison  him...and  that,  in  some  way,  Mr.s.  Inglethorp  got  hold  of  it  by  mistake. "
3035,geco,3-184,But  I  don't  at  all  see  how  it  could  have  been  done. 
3036,geco,3-185,The  whole  thing  is  absurd  and  ridiculous  to  the  last  degree. 
3037,geco,3-186,Still  you  are  right  in  one  thing. 
3038,geco,3-187,"It  is  always  wise  to  suspect  everybody  until  you  can  prove  logically,  and  to  your  own  satisfaction,  that  they  are  innocent. "
3039,geco,3-188,"Now,  what  reasons  are  there  against  Miss  Howard's  having  deliberately  poisoned  Mr.s.  Inglethorp? "
3040,geco,3-189,"Why,  she  was  devoted  to  her!  I  exclaimed. "
3041,geco,3-190,Tcha!  Tcha!  cried  Poirot  irritably. 
3042,geco,3-191,You  argue  like  a  child. 
3043,geco,3-192,"If  Miss  Howard  were  capable  of  poisoning  the  old  lady,  she  would  be  quite  equally  capable  of  simulating  devotion. "
3044,geco,3-193,"No,  we  must  look  elsewhere. "
3045,geco,3-194,You  are  perfectly  correct  in  your  assumption  that  her  vehemence  against  Alfred  Inglethorp  is  too  violent  to  be  natural;  but  you  are  quite  wrong  in  the  deduction  you  draw  from  it. 
3046,geco,3-195,"I  have  drawn  my  own  deductions,  which  I  believe  to  be  correct,  but  I  will  not  speak  of  them  at  present. "
3047,geco,3-196,"He  paused  a  minute,  then  went  on. "
3048,geco,3-197,"Now,  to  my  way  of  thinking,  there  is  one  insuperable  objection  to  Miss  Howard's  being  the  murderess. "
3049,geco,3-198,And  that  is? 
3050,geco,3-199,That  in  no  possible  way  could  Mr.s.  Inglethorp's  death  benefit  Miss  Howard. 
3051,geco,3-200,Now  there  is  no  murder  without  a  motive. 
3052,geco,3-201,I  reflected. 
