,dataset_name,sentence_number,sentences
1181,geco,1-1182,And  nobody  else  has  anything  green? 
1182,geco,1-1183,"No,  sir...not  that  I  know  of. "
1183,geco,1-1184,Poirot's  face  did  not  betray  a  trace  of  whether  he  was  disappointed  or  otherwise. 
1184,geco,1-1185,"He  merely  remarked:  Good,  we  will  leave  that  and  pass  on. "
1185,geco,1-1186,Have  you  any  reason  to  believe  that  your  mistress  was  likely  to  take  a  sleeping  powder  last  night? 
1186,geco,1-1187,"Not  last  night,  sir,  I  know  she  didn't. "
1187,geco,1-1188,Why  do  you  know  so  positively? 
1188,geco,1-1189,Because  the  box  was  empty. 
1189,geco,1-1190,"She  took  the  last  one  two  days  ago,  and  she  didn't  have  any  more  made  up. "
1190,geco,1-1191,You  are  quite  sure  of  that? 
1191,geco,1-1192,"Positive,  sir. "
1192,geco,1-1193,Then  that  is  cleared  up! 
1193,geco,1-1194,"By  the  way,  your  mistress  didn't  ask  you  to  sign  any  paper  yesterday? "
1194,geco,1-1195,To  sign  a  paper? 
1195,geco,1-1196,"No,  sir. "
1196,geco,1-1197,"When  mr  Hastings  and  mr  Lawrence  came  in  yesterday  evening,  they  found  your  mistress  busy  writing  letters. "
1197,geco,1-1198,I  suppose  you  can  give  me  no  idea  to  whom  these  letters  were  addressed? 
1198,geco,1-1199,"I'm  afraid  I  couldn't,  sir. "
1199,geco,1-1200,I  was  out  in  the  evening. 
1200,geco,1-1201,"Perhaps  Annie  could  tell  you,  though  she's  a  careless  girl. "
1201,geco,1-1202,Never  cleared  the  coffee-cups  away  last  night. 
1202,geco,1-1203,That's  what  happens  when  I'm  not  here  to  look  after  things. 
1203,geco,1-1204,Poirot  lifted  his  hand. 
1204,geco,1-1205,"Since  they  have  been  left,  Dorcas,  leave  them  a  little  longer,  I  pray  you. "
1205,geco,1-1206,I  should  like  to  examine  them. 
1206,geco,1-1207,"Very  well,  sir. "
1207,geco,1-1208,What  time  did  you  go  out  last  evening? 
1208,geco,1-1209,"About  six  o'clock,  sir. "
1209,geco,1-1210,"Thank  you,  Dorcas,  that  is  all  I  have  to  ask  you. "
1210,geco,1-1211,He  rose  and  strolled  to  the  window. 
1211,geco,1-1212,I  have  been  admiring  these  flower  beds. 
1212,geco,1-1213,"How  many  gardeners  are  employed  here,  by  the  way? "
1213,geco,1-1214,"Only  three  now,  sir. "
1214,geco,1-1215,"Five,  we  had,  before  the  war,  when  it  was  kept  as  a  gentleman's  place  should  be. "
1215,geco,1-1216,"I  wish  you  could  have  seen  it  then,  sir. "
1216,geco,1-1217,A  fair  sight  it  was. 
1217,geco,1-1218,"But  now  there's  only  old  Manning,  and  young  William,  and  a  new-fashioned  woman  gardener  in  breeches  and  such-like. "
1218,geco,1-1219,"Ah,  these  are  dreadful  times! "
1219,geco,1-1220,"The  good  times  will  come  again,  Dorcas. "
1220,geco,1-1221,"At  least,  we  hope  so. "
1221,geco,1-1222,"Now,  will  you  send  Annie  to  me  here? "
1222,geco,1-1223,"Yes,  sir. "
1223,geco,1-1224,"Thank  you,  sir. "
1224,geco,1-1225,"How  did  you  know  that  Mr.s.  Inglethorp  took  sleeping  powders?  I  asked,  in  lively  curiosity,  as  Dorcas  left  the  room. "
1225,geco,1-1226,And  about  the  lost  key  and  the  duplicate? 
1226,geco,1-1227,One  thing  at  a  time. 
1227,geco,1-1228,"As  to  the  sleeping  powders,  I  knew  by  this. "
1228,geco,1-1229,"He  suddenly  produced  a  small  cardboard  box,  such  as  chemists  use  for  powders. "
1229,geco,1-1230,Where  did  you  find  it? 
1230,geco,1-1231,In  the  wash-stand  drawer  in  Mr.s.  Inglethorp's  bedroom. 
1231,geco,1-1232,It  was  Number  Six  of  my  catalogue. 
1232,geco,1-1233,"But  I  suppose,  as  the  last  powder  was  taken  two  days  ago,  it  is  not  of  much  importance? "
1233,geco,1-1234,"Probably  not,  but  do  you  notice  anything  that  strikes  you  as  peculiar  about  this  box? "
1234,geco,1-1235,I  examined  it  closely. 
1235,geco,1-1236,"No,  I  can't  say  that  I  do. "
1236,geco,1-1237,Look  at  the  label. 
1237,geco,1-1238,"I  read  the  label  carefully:  'One  powder  to  be  taken  at  bedtime,  if  required. "
1238,geco,1-1239,Mr.s.  Inglethorp.' 
1239,geco,1-1240,"No,  I  see  nothing  unusual. "
1240,geco,1-1241,Not  the  fact  that  there  is  no  chemist's  name? 
1241,geco,1-1242,Ah! 
1242,geco,1-1243,I  exclaimed. 
1243,geco,1-1244,"To  be  sure,  that  is  odd! "
1244,geco,1-1245,"Have  you  ever  known  a  chemist  to  send  out  a  box  like  that,  without  his  printed  name? "
1245,geco,1-1246,"No,  I  can't  say  that  I  have. "
1246,geco,1-1247,"I  was  becoming  quite  excited,  but  Poirot  damped  my  ardour  by  remarking:  Yet  the  explanation  is  quite  simple.So "
1247,geco,1-1248,"do  not  intrigue  yourself,  my  friend. "
1248,geco,1-1249,"An  audible  creaking  proclaimed  the  approach  of  Annie,  so  I  had  no  time  to  reply. "
1249,geco,1-1250,"Annie  was  a  fine,  strapping  girl,  and  was  evidently  labouring  under  intense  excitement,  mingled  with  a  certain  ghoulish  enjoyment  of  the  tragedy. "
1250,geco,1-1251,"Poirot  came  to  the  point  at  once,  with  a  business-like  briskness. "
1251,geco,1-1252,"I  sent  for  you,  Annie,  because  I  thought  you  might  be  able  to  tell  me  something  about  the  letters  Mr.s.  Inglethorp  wrote  last  night. "
1252,geco,1-1253,How  many  were  there? 
1253,geco,1-1254,And  can  you  tell  me  any  of  the  names  and  addresses? 
1254,geco,1-1255,Annie  considered. 
1255,geco,1-1256,"There  were  four  letters,  sir. "
1256,geco,1-1257,"One  was  to  Miss  Howard,  and  one  was  to  mr  Wells,  the  lawyer,  and  the  other  two  I  don't  think  I  remember,  sir...oh,  yes,  one  was  to  Ross's,  the  caterers  in  Tadminster. "
1257,geco,1-1258,"The  other  one,  I  don't  remember. "
1258,geco,1-1259,"Think,  urged  Poirot. "
1259,geco,1-1260,Annie  racked  her  brains  in  vain. 
1260,geco,1-1261,"I'm  sorry,  sir,  but  it's  clean  gone. "
1261,geco,1-1262,I  don't  think  I  can  have  noticed  it. 
1262,geco,1-1263,"It  does  not  matter,  said  Poirot,  not  betraying  any  sign  of  disappointment. "
1263,geco,1-1264,Now  I  want  to  ask  you  about  something  else. 
1264,geco,1-1265,There  is  a  saucepan  in  Mr.s.  Inglethorp's  room  with  some  cocoa  in  it. 
1265,geco,1-1266,Did  she  have  that  every  night? 
1266,geco,1-1267,"Yes,  sir,  it  was  put  in  her  room  every  evening,  and  she  warmed  it  up  in  the  night...whenever  she  fancied  it. "
1267,geco,1-1268,What  was  it? 
1268,geco,1-1269,Plain  cocoa? 
1269,geco,1-1270,"Yes,  sir,  made  with  milk,  with  a  teaspoonful  of  sugar,  and  two  teaspoonfuls  of  rum  in  it. "
1270,geco,1-1271,Who  took  it  to  her  room? 
1271,geco,1-1272,"I  did,  sir. "
1272,geco,1-1273,Always? 
1273,geco,1-1274,"Yes,  sir. "
1274,geco,1-1275,At  what  time? 
1275,geco,1-1276,"When  I  went  to  draw  the  curtains,  as  a  rule,  sir. "
1276,geco,1-1277,Did  you  bring  it  straight  up  from  the  kitchen  then? 
1277,geco,1-1278,"No,  sir,  you  see  there's  not  much  room  on  the  gas  stove,  so  Cook  used  to  make  it  early,  before  putting  the  vegetables  on  for  supper. "
1278,geco,1-1279,"Then  I  used  to  bring  it  up,  and  put  it  on  the  table  by  the  swing  door,  and  take  it  into  her  room  later. "
1279,geco,1-1280,"The  swing  door  is  in  the  left  wing,  is  it  not? "
1280,geco,1-1281,"Yes,  sir. "
1281,geco,1-1282,"And  the  table,  is  it  on  this  side  of  the  door,  or  on  the  farther...servants'  side? "
1282,geco,1-1283,"It's  this  side,  sir. "
1283,geco,1-1284,What  time  did  you  bring  it  up  last  night? 
1284,geco,1-1285,"About  quarter-past  seven,  I  should  say,  sir. "
1285,geco,1-1286,And  when  did  you  take  it  into  Mr.s.  Inglethorp's  room? 
1286,geco,1-1287,"When  I  went  to  shut  up,  sir. "
1287,geco,1-1288,About  eight  o'clock. 
1288,geco,1-1289,Mr.s.  Inglethorp  came  up  to  bed  before  I'd  finished. 
1289,geco,1-1290,"Then,  between  7.15 "
1290,geco,1-1291,"and  8 o'clock,  the  cocoa  was  standing  on  the  table  in  the  left  wing? "
1291,geco,1-1292,"Yes,  sir. "
1292,geco,1-1293,"Annie  had  been  growing  redder  and  redder  in  the  face,  and  now  she  blurted  out  unexpectedly:  And  if  there  was  salt  in  it,  sir,  it  wasn't  me. "
1293,geco,1-1294,I  never  took  the  salt  near  it. 
1294,geco,1-1295,What  makes  you  think  there  was  salt  in  it?  asked  Poirot. 
1295,geco,1-1296,"Seeing  it  on  the  tray,  sir. "
1296,geco,1-1297,You  saw  some  salt  on  the  tray? 
1297,geco,1-1298,Yes. 
1298,geco,1-1299,"Coarse  kitchen  salt,  it  looked. "
1299,geco,1-1300,"I  never  noticed  it  when  I  took  the  tray  up,  but  when  I  came  to  take  it  into  the  mistress's  room  I  saw  it  at  once,  and  I  suppose  I  ought  to  have  taken  it  down  again,  and  asked  Cook  to  make  some  fresh. "
1300,geco,1-1301,"But  I  was  in  a  hurry,  because  Dorcas  was  out,  and  I  thought  maybe  the  cocoa  itself  was  all  right,  and  the  salt  had  only  gone  on  the  tray. "
1301,geco,1-1302,"So  I  dusted  it  off  with  my  apron,  and  took  it  in. "
1302,geco,1-1303,I  had  the  utmost  difficulty  in  controlling  my  excitement. 
1303,geco,1-1304,"Unknown  to  herself,  Annie  had  provided  us  with  an  important  piece  of  evidence. "
1304,geco,1-1305,"How  she  would  have  gaped  if  she  had  realized  that  her  coarse  kitchen  salt  was  strychnine,  one  of  the  most  deadly  poisons  known  to  mankind. "
1305,geco,1-1306,I  marvelled  at  Poirot's  calm. 
1306,geco,1-1307,His  self-control  was  astonishing. 
1307,geco,1-1308,"I  awaited  his  next  question  with  impatience,  but  it  disappointed  me. "
1308,geco,1-1309,"When  you  went  into  Mr.s.  Inglethorp's  room,  was  the  door  leading  into  Miss  Cynthia's  room  bolted? "
1309,geco,1-1310,Oh! 
1310,geco,1-1311,"Yes,  sir;  it  always  was. "
1311,geco,1-1312,It  had  never  been  opened. 
1312,geco,1-1313,And  the  door  into  mr  Inglethorp's  room? 
1313,geco,1-1314,Did  you  notice  if  that  was  bolted  too? 
1314,geco,1-1315,Annie  hesitated. 
1315,geco,1-1316,"I  couldn't  rightly  say,  sir;  it  was  shut  but  I  couldn't  say  whether  it  was  bolted  or  not. "
1316,geco,1-1317,"When  you  finally  left  the  room,  did  Mr.s.  Inglethorp  bolt  the  door  after  you? "
1317,geco,1-1318,"No,  sir,  not  then,  but  I  expect  she  did  later. "
1318,geco,1-1319,She  usually  did  lock  it  at  night. 
1319,geco,1-1320,"The  door  into  the  passage,  that  is. "
1320,geco,1-1321,Did  you  notice  any  candle  grease  on  the  floor  when  you  did  the  room  yesterday? 
1321,geco,1-1322,Candle  grease? 
1322,geco,1-1323,"Oh,  no,  sir. "
1323,geco,1-1324,"Mr.s.  Inglethorp  didn't  have  a  candle,  only  a  reading-lamp. "
1324,geco,1-1325,"Then,  if  there  had  been  a  large  patch  of  candle  grease  on  the  floor,  you  think  you  would  have  been  sure  to  have  seen  it? "
1325,geco,1-1326,"Yes,  sir,  and  I  would  have  taken  it  out  with  a  piece  of  blotting-paper  and  a  hot  iron. "
1326,geco,1-1327,Then  Poirot  repeated  the  question  he  had  put  to  Dorcas:  Did  your  mistress  ever  have  a  green  dress? 
1327,geco,1-1328,"No,  sir. "
1328,geco,1-1329,"Nor  a  mantle,  nor  a  cape,  nor  a...how  do  you  call  it?...a "
1329,geco,1-1330,sports  coat? 
1330,geco,1-1331,"Not  green,  sir. "
1331,geco,1-1332,Nor  anyone  else  in  the  house? 
1332,geco,1-1333,Annie  reflected. 
1333,geco,1-1334,"No,  sir. "
1334,geco,1-1335,You  are  sure  of  that? 
1335,geco,1-1336,Quite  sure. 
1336,geco,1-1337,Bien! 
1337,geco,1-1338,That  is  all  I  want  to  know. 
1338,geco,1-1339,Thank  you  very  much. 
1339,geco,1-1340,"With  a  nervous  giggle,  Annie  took  herself  creakingly  out  of  the  room. "
1340,geco,1-1341,My  pent-up  excitement  burst  forth. 
1341,geco,1-1342,"Poirot,  I  cried,  I  congratulate  you! "
1342,geco,1-1343,This  is  a  great  discovery. 
1343,geco,1-1344,What  is  a  great  discovery? 
1344,geco,1-1345,"Why,  that  it  was  the  cocoa  and  not  the  coffee  that  was  poisoned. "
1345,geco,1-1346,That  explains  everything! 
1346,geco,1-1347,"Of  course  it  did  not  take  effect  until  the  early  morning,  since  the  cocoa  was  only  drunk  in  the  middle  of  the  night. "
1347,geco,1-1348,"So  you  think  that  the  cocoa...mark  well  what  I  say,  Hastings,  the  cocoa...contained  strychnine? "
1348,geco,1-1349,Of  course! 
1349,geco,1-1350,"That  salt  on  the  tray,  what  else  could  it  have  been? "
1350,geco,1-1351,"It  might  have  been  salt,  replied  Poirot  placidly. "
1351,geco,1-1352,I  shrugged  my  shoulders. 
1352,geco,1-1353,"If  he  was  going  to  take  the  matter  that  way,  it  was  no  good  arguing  with  him. "
1353,geco,1-1354,"The  idea  crossed  my  mind,  not  for  the  first  time,  that  poor  old  Poirot  was  growing  old. "
1354,geco,1-1355,Privately  I  thought  it  lucky  that  he  had  associated  with  him  some  one  of  a  more  receptive  type  of  mind. 
1355,geco,1-1356,Poirot  was  surveying  me  with  quietly  twinkling  eyes. 
1356,geco,1-1357,"You  are  not  pleased  with  me,  mon  ami? "
1357,geco,1-1358,"My  dear  Poirot,  I  said  coldly,  it  is  not  for  me  to  dictate  to  you. "
1358,geco,1-1359,"You  have  a  right  to  your  own  opinion,  just  as  I  have  to  mine. "
1359,geco,1-1360,"A  most  admirable  sentiment,  remarked  Poirot,  rising  briskly  to  his  feet. "
1360,geco,1-1361,Now  I  have  finished  with  this  room. 
1361,geco,1-1362,"By  the  way,  whose  is  the  smaller  desk  in  the  corner? "
1362,geco,1-1363,mr  Inglethorp's. 
1363,geco,1-1364,Ah! 
1364,geco,1-1365,He  tried  the  roll  top  tentatively. 
1365,geco,1-1366,Locked. 
1366,geco,1-1367,But  perhaps  one  of  Mr.s.  Inglethorp's  keys  would  open  it. 
1367,geco,1-1368,"He  tried  several,  twisting  and  turning  them  with  a  practiced  hand,  and  finally  uttering  an  ejaculation  of  satisfaction. "
1368,geco,1-1369,Voila! 
1369,geco,1-1370,"It  is  not  the  key,  but  it  will  open  it  at  a  pinch. "
1370,geco,1-1371,"He  slid  back  the  roll  top,  and  ran  a  rapid  eye  over  the  neatly  filed  papers. "
1371,geco,1-1372,"To  my  surprise,  he  did  not  examine  them,  merely  remarking  approvingly  as  he  relocked  the  desk:  Decidedly,  he  is  a  man  of  method,  this  mr  Inglethorp! "
1372,geco,1-1373,"A  'man  of  method'  was,  in  Poirot's  estimation,  the  highest  praise  that  could  be  bestowed  on  any  individual. "
1373,geco,1-1374,"I  felt  that  my  friend  was  not  what  he  had  been  as  he  rambled  on  disconnectedly:  There  were  no  stamps  in  his  desk,  but  there  might  have  been,  eh,  mon  ami? "
1374,geco,1-1375,Yes ...his  eyes  wandered  round  the  room... this  boudoir  has  nothing  more  to  tell  us. 
1375,geco,1-1376,It  did  not  yield  much. 
1376,geco,1-1377,Only  this. 
1377,geco,1-1378,"He  pulled  a  crumpled  envelope  out  of  his  pocket,  and  tossed  it  over  to  me. "
1378,geco,1-1379,It  was  rather  a  curious  document. 
1379,geco,1-1380,"A  plain,  dirty  looking  old  envelope  with  a  few  words  scrawled  across  it,  apparently  at  random. "
1380,geco,1-1381,The  following  is  a  facsimile  of  it. 
1381,geco,2-1,"Where did you  find  this?  I  asked  Poirot,  in  lively  curiosity. "
1382,geco,2-2,In  the  waste-paper  waste-paper  basket. 
1383,geco,2-3,You  recognise  the  handwriting? 
1384,geco,2-4,"Yes,  it  is  Mr.s.  Inglethorp's. "
1385,geco,2-5,But  what  does  it  mean? 
1386,geco,2-6,Poirot  shrugged  his  shoulders. 
1387,geco,2-7,I  cannot  say...but  it  is  suggestive. 
1388,geco,2-8,A  wild  idea  flashed  across  me. 
1389,geco,2-9,Was  it  possible  that  Mr.s.  Inglethorp's  mind  was  deranged? 
1390,geco,2-10,Had  she  some  fantastic  idea  of  demoniacal  possession? 
1391,geco,2-11,"And,  if  that  were  so,  was  it  not  also  possible  that  she  might  have  taken  her  own  life? "
1392,geco,2-12,"I  was  about  to  expound  these  theories  to  Poirot,  when  his  own  words  distracted  me. "
1393,geco,2-13,"Come,  he  said,  now  to  examine  the  coffee-cups! "
1394,geco,2-14,My  dear  Poirot! 
1395,geco,2-15,"What  on  earth  is  the  good  of  that,  now  that  we  know  about  the  cocoa? "
1396,geco,2-16,"Oh,  la  la! "
1397,geco,2-17,That  miserable  cocoa!  cried  Poirot  flippantly. 
1398,geco,2-18,"He  laughed  with  apparent  enjoyment,  raising  his  arms  to  heaven  in  mock  despair,  in  what  I  could  not  but  consider  the  worst  possible  taste. "
1399,geco,2-19,"And,  anyway,  I  said,  with  increasing  coldness,  as  Mr.s.  Inglethorp  took  her  coffee  upstairs  with  her,  I  do  not  see  what  you  expect  to  find,  unless  you  consider  it  likely  that  we  shall  discover  a  packet  of  strychnine  on  the  coffee  tray! "
1400,geco,2-20,Poirot  was  sobered  at  once. 
1401,geco,2-21,"Come,  come,  my  friend,  he  said,  slipping  his  arms  through  mine. "
1402,geco,2-22,Ne  vous  fachez  pas! 
1403,geco,2-23,"Allow  me  to  interest  myself  in  my  coffee-cups,  coffee-cups,  and  I  will  respect  your  cocoa. "
1404,geco,2-24,There! 
1405,geco,2-25,Is  it  a  bargain? 
1406,geco,2-26,"He  was  so  quaintly  humorous  that  I  was  forced  to  laugh;  and  we  went  together  to  the  drawing-room,  where  the  coffee-cups  and  tray  remained  undisturbed  as  we  had  left  them. "
1407,geco,2-27,"Poirot  made  me  recapitulate  the  scene  of  the  night  before,  listening  very  carefully,  and  verifying  the  position  of  the  various  cups. "
1408,geco,2-28,So  Mr.s.  Cavendish  stood  by  the  tray...and  poured  out. 
1409,geco,2-29,Yes. 
1410,geco,2-30,Then  she  came  across  to  the  window  where  you  sat  with  Mademoiselle  Cynthia. 
1411,geco,2-31,Yes. 
1412,geco,2-32,Here  are  the  three  cups. 
1413,geco,2-33,"And  the  cup  on  the  mantel-piece,  half  drunk,  that  would  be  Mr.  Lawrence  Cavendish's. "
1414,geco,2-34,And  the  one  on  the  tray? 
1415,geco,2-35,John  Cavendish's. 
1416,geco,2-36,I  saw  him  put  it  down  there. 
1417,geco,2-37,Good. 
1418,geco,2-38,"One,  two,  three,  four,  five...but  where,  then,  is  the  cup  of  Mr.  Inglethorp? "
1419,geco,2-39,He  does  not  take  coffee. 
1420,geco,2-40,Then  all  are  accounted  for. 
1421,geco,2-41,"One  moment,  my  friend. "
1422,geco,2-42,"With  infinite  care,  he  took  a  drop  or  two  from  the  grounds  in  each  cup,  sealing  them  up  in  separate  test  tubes,  tasting  each  in  turn  as  he  did  so. "
1423,geco,2-43,His  physiognomy  underwent  a  curious  change. 
1424,geco,2-44,"An  expression  gathered  there  that  I  can  only  describe  as  half  puzzled,  and  half  relieved. "
1425,geco,2-45,Bien!  he  said  at  last. 
1426,geco,2-46,It  is  evident! 
1427,geco,2-47,I  had  an  idea...but  clearly  I  was  mistaken. 
1428,geco,2-48,"Yes,  altogether  I  was  mistaken. "
1429,geco,2-49,Yet  it  is  strange. 
1430,geco,2-50,But  no  matter! 
1431,geco,2-51,"And,  with  a  characteristic  shrug,  he  dismissed  whatever  it  was  that  was  worrying  him  from  his  mind. "
1432,geco,2-52,"I  could  have  told  him  from  the  beginning  that  this  obsession  of  his  over  the  coffee  was  bound  to  end  in  a  blind  alley,  but  I  restrained  my  tongue. "
1433,geco,2-53,"After  all,  though  he  was  old,  Poirot  had  been  a  great  man  in  his  day. "
1434,geco,2-54,"Breakfast  is  ready,  said  John  Cavendish,  coming  in  from  the  hall. "
1435,geco,2-55,"You  will  breakfast  with  us,  Monsieur  Poirot? "
1436,geco,2-56,Poirot  acquiesced. 
1437,geco,2-57,I  observed  John. 
1438,geco,2-58,Already  he  was  almost  restored  to  his  normal  self. 
1439,geco,2-59,"The  shock  of  the  events  of  the  last  night  had  upset  him  temporarily,  but  his  equable  poise  soon  swung  back  to  the  normal. "
1440,geco,2-60,"He  was  a  man  of  very  little  imagination,  in  sharp  contrast  with  his  brother,  who  had,  perhaps,  too  much. "
1441,geco,2-61,"Ever  since  the  early  hours  of  the  morning,  John  had  been  hard  at  work,  sending  telegrams...one  of  the  first  had  gone  to  Evelyn  Howard...writing  notices  for  the  papers,  and  generally  occupying  himself  with  the  melancholy  duties  that  a  death  entails. "
1442,geco,2-62,May  I  ask  how  things  are  proceeding?  he  said. 
1443,geco,2-63,Do  your  investigations  point  to  my  mother  having  died  a  natural  death...or...or  must  we  prepare  ourselves  for  the  worst? 
1444,geco,2-64,"I  think,  Mr.  Cavendish,  said  Poirot  gravely,  that  you  would  do  well  not  to  buoy  yourself  up  with  any  false  hopes. "
1445,geco,2-65,Can  you  tell  me  the  views  of  the  other  members  of  the  family? 
1446,geco,2-66,My  brother  Lawrence  is  convinced  that  we  are  making  a  fuss  over  nothing. 
1447,geco,2-67,He  says  that  everything  points  to  its  being  a  simple  case  of  heart  failure. 
1448,geco,2-68,"He  does,  does  he? "
1449,geco,2-69,"That  is  very  interesting...very  interesting,  murmured  Poirot  softly. "
1450,geco,2-70,And  Mr.s.  Cavendish? 
1451,geco,2-71,A  faint  cloud  passed  over  John's  face. 
1452,geco,2-72,I  have  not  the  least  idea  what  my  wife's  views  on  the  subject  are. 
1453,geco,2-73,The  answer  brought  a  momentary  stiffness  in  its  train. 
1454,geco,2-74,"John  broke  the  rather  awkward  silence  by  saying  with  a  slight  effort:  I  told  you,  didn't  I,  that  Mr.  Inglethorp  has  returned? "
1455,geco,2-75,Poirot  bent  his  head. 
1456,geco,2-76,It's  an  awkward  position  for  all  of  us. 
1457,geco,2-77,"Of  course  one  has  to  treat  him  as  usual...but,  hang  it  all,  one's  gorge  does  rise  at  sitting  down  to  eat  with  a  possible  murderer! "
1458,geco,2-78,Poirot  nodded  sympathetically. 
1459,geco,2-79,I  quite  understand. 
1460,geco,2-80,"It  is  a  very  difficult  situation  for  you,  Mr.  Cavendish. "
1461,geco,2-81,I  would  like  to  ask  you  one  question. 
1462,geco,2-82,"Mr.  Inglethorp's  reason  for  not  returning  last  night  was,  I  believe,  that  he  had  forgotten  the  latch-key. "
1463,geco,2-83,Is  not  that  so? 
1464,geco,2-84,Yes. 
1465,geco,2-85,I  suppose  you  are  quite  sure  that  the  latch-key  was  forgotten...that  he  did  not  take  it  after  all? 
1466,geco,2-86,I  have  no  idea. 
1467,geco,2-87,I  never  thought  of  looking. 
1468,geco,2-88,We  always  keep  it  in  the  hall  drawer. 
1469,geco,2-89,I'll  go  and  see  if  it's  there  now. 
1470,geco,2-90,Poirot  held  up  his  hand  with  a  faint  smile. 
1471,geco,2-91,"No,  no,  Mr.  Cavendish,  it  is  too  late  now. "
1472,geco,2-92,I  am  certain  that  you  would  find  it. 
1473,geco,2-93,"If  Mr.  Inglethorp  did  take  it,  he  has  had  ample  time  to  replace  it  by  now. "
1474,geco,2-94,But  do  you  think...... 
1475,geco,2-95,I think  nothing. 
1476,geco,2-96,"If  anyone  had  chanced  to  look  this  morning  before  his  return,  and  seen  it  there,  it  would  have  been  a  valuable  point  in  his  favour. "
1477,geco,2-97,That  is  all. 
1478,geco,2-98,John  looked  perplexed. 
1479,geco,2-99,"Do  not  worry,  said  Poirot  smoothly. "
1480,geco,2-100,I  assure  you  that  you  need  not  let  it  trouble  you. 
1481,geco,2-101,"Since  you  are  so  kind,  let  us  go  and  have  some  breakfast. "
1482,geco,2-102,Every  one  was  assembled  in  the  dining-room. 
1483,geco,2-103,dining-room. 
1484,geco,2-104,"Under  the  circumstances,  we  were  naturally  not  a  cheerful  party. "
1485,geco,2-105,"The  reaction  after  a  shock  is  always  trying,  and  I  think  we  were  all  suffering  from  it. "
1486,geco,2-106,"Decorum  and  good  breeding  naturally  enjoined  that  our  demeanour  should  be  much  as  usual,  yet  I  could  not  help  wondering  if  this  self-control  were  really  a  matter  of  great  difficulty. "
1487,geco,2-107,"There  were  no  red  eyes,  no  signs  of  secretly  indulged  grief. "
1488,geco,2-108,I  felt  that  I  was  right  in  my  opinion  that  Dorcas  was  the  person  most  affected  by  the  personal  side  of  the  tragedy. 
1489,geco,2-109,"I  pass  over  Alfred  Inglethorp,  who  acted  the  bereaved  widower  in  a  manner  that  I  felt  to  be  disgusting  in  its  hypocrisy. "
1490,geco,2-110,"Did  he  know  that  we  suspected  him,  I  wondered. "
1491,geco,2-111,"Surely  he  could  not  be  unaware  of  the  fact,  conceal  it  as  we  would. "
1492,geco,2-112,"Did  he  feel  some  secret  stirring  of  fear,  or  was  he  confident  that  his  crime  would  go  unpunished? "
1493,geco,2-113,Surely  the  suspicion  in  the  atmosphere  must  warn  him  that  he  was  already  a  marked  man. 
1494,geco,2-114,But  did  every  one  suspect  him? 
1495,geco,2-115,What  about  Mr.s.  Cavendish? 
1496,geco,2-116,"I  watched  her  as  she  sat  at  the  head  of  the  table,  graceful,  composed,  enigmatic. "
1497,geco,2-117,"In  her  soft  grey  frock,  with  white  ruffles  at  the  wrists  falling  over  her  slender  hands,  she  looked  very  beautiful. "
1498,geco,2-118,"When  she  chose,  however,  her  face  could  be  sphinx-like  in  its  inscrutability. "
1499,geco,2-119,"She  was  very  silent,  hardly  opening  her  lips,  and  yet  in  some  queer  way  I  felt  that  the  great  strength  of  her  personality  was  dominating  us  all. "
1500,geco,2-120,And  little  Cynthia? 
1501,geco,2-121,Did  she  suspect? 
