,dataset_name,sentence_number,sentences
4347,geco,4-67,If  I  am  called  upon  to  give  evidence  at  all ...he  smiled  broadly... it  will  probably  be  as  a  witness  for  the  defence. 
4348,geco,4-68,I  could  hardly  believe  my  ears. 
4349,geco,4-69,"It  is  quite  en  regle,  continued  Poirot. "
4350,geco,4-70,"Strangely  enough,  I  can  give  evidence  that  will  demolish  one  contention  of  the  prosecution. "
4351,geco,4-71,Which  one? 
4352,geco,4-72,The  one  that  relates  to  the  destruction  of  the  will. 
4353,geco,4-73,John  Cavendish  did  not  destroy  that  will. 
4354,geco,4-74,Poirot  was  a  true  prophet. 
4355,geco,4-75,"I  will  not  go  into  the  details  of  the  police  court  proceedings,  as  it  involves  many  tiresome  repetitions. "
4356,geco,4-76,"I  will  merely  state  baldly  that  John  Cavendish  reserved  his  defence,  and  was  duly  committed  for  trial. "
4357,geco,4-77,September  found  us  all  in  London. 
4358,geco,4-78,"Mary  took  a  house  in  Kensington,  Poirot  being  included  in  the  family  party. "
4359,geco,4-79,"I  myself  had  been  given  a  job  at  the  War  Office,  so  was  able  to  see  them  continually. "
4360,geco,4-80,"As  the  weeks  went  by,  the  state  of  Poirot's  nerves  grew  worse  and  worse. "
4361,geco,4-81,That  'last  link'  he  talked  about  was  still  lacking. 
4362,geco,4-82,"Privately,  I  hoped  it  might  remain  so,  for  what  happiness  could  there  be  for  Mary,  if  John  were  not  acquitted? "
4363,geco,4-83,"On  September  15th  John  Cavendish  appeared  in  the  dock  at  the  Old  Bailey,  charged  with  The  Wilful  Murder  of  Emily  Agnes  Inglethorp,  and  pleaded  Not  Guilty. "
4364,geco,4-84,"Sir  Ernest  Heavywether,  the  famous  K. "
4365,geco,4-85,"C., "
4366,geco,4-86,had  been  engaged  to  defend  him. 
4367,geco,4-87,"Mr.  Philips,  K. "
4368,geco,4-88,"C., "
4369,geco,4-89,opened  the  case  for  the  Crown. 
4370,geco,4-90,"The  murder,  he  said,  was  a  most  premeditated  and  cold-blooded  one. "
4371,geco,4-91,It  was  neither  more  nor  less  than  the  deliberate  poisoning  of  a  fond  and  trusting  woman  by  the  stepson  to  whom  she  had  been  more  than  a  mother. 
4372,geco,4-92,"Ever  since  his  boyhood,  she  had  supported  him. "
4373,geco,4-93,"He  and  his  wife  had  lived  at  Styles  Court  in  every  luxury,  surrounded  by  her  care  and  attention. "
4374,geco,4-94,She  had  been  their  kind  and  generous  benefactress. 
4375,geco,4-95,"He  proposed  to  call  witnesses  to  show  how  the  prisoner,  a  profligate  and  spendthrift,  had  been  at  the  end  of  his  financial  tether,  and  had  also  been  carrying  on  an  intrigue  with  a  certain  Mr.s.  Raikes,  a  neighbouring  farmer's  wife. "
4376,geco,4-96,"This  having  come  to  his  stepmother's  ears,  she  taxed  him  with  it  on  the  afternoon  before  her  death,  and  a  quarrel  ensued,  part  of  which  was  overheard. "
4377,geco,4-97,"On  the  previous  day,  the  prisoner  had  purchased  strychnine  at  the  village  chemist's  shop,  wearing  a  disguise  by  means  of  which  he  hoped  to  throw  the  onus  of  the  crime  upon  another  man...to  wit,  Mr.s.  Inglethorp's  husband,  of  whom  he  had  been  bitterly  jealous. "
4378,geco,4-98,"Luckily  for  Mr.  Inglethorp,  he  had  been  able  to  produce  an  unimpeachable  alibi. "
4379,geco,4-99,"On  the  afternoon  of  July  17th,  continued  Counsel,  immediately  after  the  quarrel  with  her  son,  Mr.s.  Inglethorp  made  a  new  will. "
4380,geco,4-100,"This  will  was  found  destroyed  in  the  grate  of  her  bedroom  the  following  morning,  but  evidence  had  come  to  light  which  showed  that  it  had  been  drawn  up  in  favour  of  her  husband. "
4381,geco,4-101,"Deceased  had  already  made  a  will  in  his  favour  before  her  marriage,  but...and  Mr.  Philips  wagged  an  expressive  forefinger...the  prisoner  was  not  aware  of  that. "
4382,geco,4-102,"What  had  induced  the  deceased  to  make  a  fresh  will,  with  the  old  one  still  extant,  he  could  not  say. "
4383,geco,4-103,"She  was  an  old  lady,  and  might  possibly  have  forgotten  the  former  one;  or...this  seemed  to  him  more  likely...she  may  have  had  an  idea  that  it  was  revoked  by  her  marriage,  as  there  had  been  some  conversation  on  the  subject. "
4384,geco,4-104,Ladies  were  not  always  very  well  versed  in  legal  knowledge. 
4385,geco,4-105,"She  had,  about  a  year  before,  executed  a  will  in  favour  of  the  prisoner. "
4386,geco,4-106,He  would  call  evidence  to  show  that  it  was  the  prisoner  who  ultimately  handed  his  stepmother  her  coffee  on  the  fatal  night. 
4387,geco,4-107,"Later  in  the  evening,  he  had  sought  admission  to  her  room,  on  which  occasion,  no  doubt,  he  found  an  opportunity  of  destroying  the  will  which,  as  far  as  he  knew,  would  render  the  one  in  his  favour  valid. "
4388,geco,4-108,"The  prisoner  had  been  arrested  in  consequence  of  the  discovery,  in  his  room,  by  Detective  Inspector  Japp...a  most  brilliant  officer...of  the  identical  phial  of  strychnine  which  had  been  sold  at  the  village  chemist's  to  the  supposed  Mr.  Inglethorp  on  the  day  before  the  murder. "
4389,geco,4-109,It  would  be  for  the  jury  to  decide  whether  or  not  these  damning  facts  constituted  an  overwhelming  proof  of  the  prisoner's  guilt. 
4390,geco,4-110,"And,  subtly  implying  that  a  jury  which  did  not  so  decide,  was  quite  unthinkable,  Mr.  Philips  sat  down  and  wiped  his  forehead. "
4391,geco,4-111,"The  first  witnesses  for  the  prosecution  were  mostly  those  who  had  been  called  at  the  inquest,  the  medical  evidence  being  again  taken  first. "
4392,geco,4-112,"Sir  Ernest  Heavywether,  who  was  famous  all  over  England  for  the  unscrupulous  manner  in  which  he  bullied  witnesses,  only  asked  two  questions. "
4393,geco,4-113,"I  take  it,  Dr  Bauerstein,  that  strychnine,  as  a  drug,  acts  quickly? "
4394,geco,4-114,Yes. 
4395,geco,4-115,And  that  you  are  unable  to  account  for  the  delay  in  this  case? 
4396,geco,4-116,Yes. 
4397,geco,4-117,Thank  you. 
4398,geco,4-118,Mr.  Mace  identified  the  phial  handed  him  by  Counsel  as  that  sold  by  him  to  Mr.  Inglethorp. 
4399,geco,4-119,"Pressed,  he  admitted  that  he  only  knew  Mr.  Inglethorp  by  sight. "
4400,geco,4-120,He  had  never  spoken  to  him. 
4401,geco,4-121,The  witness  was  not  cross-examined. 
4402,geco,4-122,"Alfred  Inglethorp  was  called,  and  denied  having  purchased  the  poison. "
4403,geco,4-123,He  also  denied  having  quarrelled  with  his  wife. 
4404,geco,4-124,Various  witnesses  testified  to  the  accuracy  of  these  statements. 
4405,geco,4-125,"The  gardeners'  evidence,  as  to  the  witnessing  of  the  will  was  taken,  and  then  Dorcas  was  called. "
4406,geco,4-126,"Dorcas,  faithful  to  her  young  gentlemen,  denied  strenuously  that  it  could  have  been  John's  voice  she  heard,  and  resolutely  declared,  in  the  teeth  of  everything,  that  it  was  Mr.  Inglethorp  who  had  been  in  the  boudoir  with  her  mistress. "
4407,geco,4-127,A  rather  wistful  smile  passed  across  the  face  of  the  prisoner  in  the  dock. 
4408,geco,4-128,"He  knew  only  too  well  how  useless  her  gallant  defiance  was,  since  it  was  not  the  object  of  the  defence  to  deny  this  point. "
4409,geco,4-129,"Mr.s.  Cavendish,  of  course,  could  not  be  called  upon  to  give  evidence  against  her  husband. "
4410,geco,4-130,"After  various  questions  on  other  matters,  Mr.  Philips  asked:  In  the  month  of  June  last,  do  you  remember  a  parcel  arriving  for  Mr.  Lawrence  Cavendish  from  Parkson's? "
4411,geco,4-131,Dorcas  shook  her  head. 
4412,geco,4-132,"I  don't  remember,  sir. "
4413,geco,4-133,"It  may  have  done,  but  Mr.  Lawrence  was  away  from  home  part  of  June. "
4414,geco,4-134,"In  the  event  of  a  parcel  arriving  for  him  whilst  he  was  away,  what  would  be  done  with  it? "
4415,geco,4-135,It  would  either  be  put  in  his  room  or  sent  on  after  him. 
4416,geco,4-136,By  you? 
4417,geco,4-137,"No,  sir,  I  should  leave  it  on  the  hall  table. "
4418,geco,4-138,It  would  be  Miss  Howard  who  would  attend  to  anything  like  that. 
4419,geco,4-139,"Evelyn  Howard  was  called  and,  after  being  examined  on  other  points,  was  questioned  as  to  the  parcel. "
4420,geco,4-140,Don't  remember. 
4421,geco,4-141,Lots  of  parcels  come. 
4422,geco,4-142,Can't  remember  one  special  one. 
4423,geco,4-143,"You  do  not  know  if  it  was  sent  after  Mr.  Lawrence  Cavendish  to  Wales,  or  whether  it  was  put  in  his  room? "
4424,geco,4-144,Don't  think  it  was  sent  after  him. 
4425,geco,4-145,Should  have  remembered  it  if  it  was. 
4426,geco,4-146,"Supposing  a  parcel  arrived  addressed  to  Mr.  Lawrence  Cavendish,  and  afterwards  it  disappeared,  should  you  remark  its  absence? "
4427,geco,4-147,"No,  don't  think  so. "
4428,geco,4-148,I  should  think  some  one  had  taken  charge  of  it. 
4429,geco,4-149,"I  believe,  Miss  Howard,  that  it  was  you  who  found  this  sheet  of  brown  paper? "
4430,geco,4-150,He  held  up  the  same  dusty  piece  which  Poirot  and  I  had  examined  in  the  morning-room  at  Styles. 
4431,geco,4-151,"Yes,  I  did. "
4432,geco,4-152,How  did  you  come  to  look  for  it? 
4433,geco,4-153,The  Belgian  detective  who  was  employed  on  the  case  asked  me  to  search  for  it. 
4434,geco,4-154,Where  did  you  eventually  discover  it? 
4435,geco,4-155,On  the  top  of...of...a  wardrobe. 
4436,geco,4-156,On  top  of  the  prisoner's  wardrobe? 
4437,geco,4-157,I...I  believe  so. 
4438,geco,4-158,Did  you  not  find  it  yourself? 
4439,geco,4-159,Yes. 
4440,geco,4-160,Then  you  must  know  where  you  found  it? 
4441,geco,4-161,"Yes,  it  was  on  the  prisoner's  wardrobe. "
4442,geco,4-162,That  is  better. 
4443,geco,4-163,"An  assistant  from  Parkson's,  Theatrical  Costumiers,  testified  that  on  June  29th,  they  had  supplied  a  black  beard  to  Mr.  L. "
4444,geco,4-164,"Cavendish,  as  requested. "
4445,geco,4-165,"It  was  ordered  by  letter,  and  a  postal  order  was  enclosed. "
4446,geco,4-166,"No,  they  had  not  kept  the  letter. "
4447,geco,4-167,All  transactions  were  entered  in  their  books. 
4448,geco,4-168,"They  had  sent  the  beard,  as  directed,  to  'L. "
4449,geco,4-169,"Cavendish,  Esq., "
4450,geco,4-170,Styles  Court.' 
4451,geco,4-171,Sir  Ernest  Heavywether  rose  ponderously. 
4452,geco,4-172,Where  was  the  letter  written  from? 
4453,geco,4-173,From  Styles  Court. 
4454,geco,4-174,The  same  address  to  which  you  sent  the  parcel? 
4455,geco,4-175,Yes. 
4456,geco,4-176,And  the  letter  came  from  there? 
4457,geco,4-177,Yes. 
4458,geco,4-178,"Like  a  beast  of  prey,  Heavywether  fell  upon  him:  How  do  you  know? "
4459,geco,4-179,I...I  don't  understand. 
4460,geco,4-180,How  do  you  know  that  letter  came  from  Styles? 
4461,geco,4-181,Did  you  notice  the  postmark? 
4462,geco,4-182,"No...but...  Ah,  you  did  not  notice  the  postmark! "
4463,geco,4-183,And  yet  you  affirm  so  confidently  that  it  came  from  Styles. 
4464,geco,4-184,"It  might,  in  fact,  have  been  any  postmark? "
4465,geco,4-185,Y...es. 
4466,geco,4-186,"In  fact,  the  letter,  though  written  on  stamped  notepaper,  might  have  been  posted  from  anywhere? "
4467,geco,4-187,"From  Wales,  for  instance? "
4468,geco,4-188,"The  witness  admitted  that  such  might  be  the  case,  and  Sir  Ernest  signified  that  he  was  satisfied. "
4469,geco,4-189,"Elizabeth  Wells,  second  housemaid  at  Styles,  stated  that  after  she  had  gone  to  bed  she  remembered  that  she  had  bolted  the  front  door,  instead  of  leaving  it  on  the  latch  as  Mr.  Inglethorp  had  requested. "
4470,geco,4-190,She  had  accordingly  gone  downstairs  again  to  rectify  her  error. 
4471,geco,4-191,"Hearing  a  slight  noise  in  the  West  wing,  she  had  peeped  along  the  passage,  and  had  seen  Mr.  John  Cavendish  knocking  at  Mr.s.  Inglethorp's  door. "
4472,geco,4-192,"Sir  Ernest  Heavywether  made  short  work  of  her,  and  under  his  unmerciful  bullying  she  contradicted  herself  hopelessly,  and  Sir  Ernest  sat  down  again  with  a  satisfied  smile  on  his  face. "
4473,geco,4-193,"With  the  evidence  of  Annie,  as  to  the  candle  grease  on  the  floor,  and  as  to  seeing  the  prisoner  take  the  coffee  into  the  boudoir,  the  proceedings  were  adjourned  until  the  following  day. "
4474,geco,4-194,"As  we  went  home,  Mary  Cavendish  spoke  bitterly  against  the  prosecuting  counsel. "
4475,geco,4-195,That  hateful  man! 
4476,geco,4-196,What  a  net  he  has  drawn  around  my  poor  John! 
4477,geco,4-197,How  he  twisted  every  little  fact  until  he  made  it  seem  what  it  wasn't! 
4478,geco,4-198,"Well,  I  said  consolingly,  it  will  be  the  other  way  about  tomorrow. "
4479,geco,4-199,"Yes,  she  said  meditatively;  then  suddenly  dropped  her  voice. "
4480,geco,4-200,"Mr.  Hastings,  you  do  not  think...surely  think...surely  it  could  not  have  been  Lawrence...Oh,  no,  that  could  not  be! "
4481,geco,4-201,"But  I  myself  was  puzzled,  and  as  soon  as  I  was  alone  with  Poirot  I  asked  him  what  he  thought  Sir  Ernest  was  driving  at. "
4482,geco,4-202,Ah!  said  Poirot  appreciatively. 
4483,geco,4-203,"He  is  a  clever  man,  that  Sir  Ernest. "
4484,geco,4-204,Do  you  think  he  believes  Lawrence  guilty? 
4485,geco,4-205,I  do  not  think  he  believes  or  cares  anything! 
4486,geco,4-206,"No,  what  he  is  trying  for  is  to  create  such  confusion  in  the  minds  of  the  jury  that  they  are  divided  in  their  opinion  as  to  which  brother  did  it. "
4487,geco,4-207,He  is  endeavouring  to  make  out  that  there  is  quite  as  much  evidence  against  Lawrence  as  against  John...and  I  am  not  at  all  sure  that  he  will  not  succeed. 
4488,geco,4-208,"Detective-inspector  Detective-inspector  Japp  was  the  first  witness  called  when  the  trial  was  reopened,  and  gave  his  evidence  succinctly  and  briefly. "
4489,geco,4-209,"After  relating  the  earlier  events,  he  proceeded:  Acting  on  information  received,  Superintendent  Summerhaye  and  myself  searched  the  prisoner's  room,  during  his  temporary  absence  from  the  house. "
4490,geco,4-210,"In  his  chest  of  drawers,  hidden  beneath  some  underclothing,  we  found:  first,  a  pair  of  gold-rimmed  pince-nez  similar  to  those  worn  by  Mr.  Inglethorp,  these  were  exhibited,  secondly,  this  phial. "
4491,geco,4-211,"The  phial  was  that  already  recognized  by  the  chemist's  assistant,  a  tiny  bottle  of  blue  glass,  containing  a  few  grains  of  a  white  crystalline  powder,  and  labelled:  Strychnine  Hydrochloride. "
4492,geco,4-212,POISON. 
4493,geco,4-213,"A  fresh  piece  of  evidence  discovered  by  the  detectives  since  the  police  court  proceedings  was  a  long,  almost  new  piece  of  blotting-paper. "
4494,geco,4-214,"It  had  been  found  in  Mr.s.  Inglethorp's  cheque  book,  and  on  being  reversed  at  a  mirror,  showed  clearly  the  words:  . "
4495,geco,4-215,. 
4496,geco,4-216,. 
4497,geco,4-217,erything  of  which  I  die  possessed  I  leave  to  my  beloved  husband  Alfred  Ing... 
4498,geco,4-218,This placed  beyond  question  the  fact  that  the  destroyed  will  had  been  in  favour  of  the  deceased  lady's  husband. 
4499,geco,4-219,"Japp  then  produced  the  charred  fragment  of  paper  recovered  from  the  grate,  and  this,  with  the  discovery  of  the  beard  in  the  attic,  completed  his  evidence. "
4500,geco,4-220,But  Sir  Ernest's  cross-examination  was  yet  to  come. 
4501,geco,4-221,What  day  was  it  when  you  searched  the  prisoner's  room? 
4502,geco,4-222,"Tuesday,  the  24th  of  July. "
4503,geco,4-223,Exactly  a  week  after  the  tragedy? 
4504,geco,4-224,Yes. 
4505,geco,4-225,"You  found  these  two  objects,  you  say,  in  the  chest  of  drawers. "
4506,geco,4-226,Was  the  drawer  unlocked? 
4507,geco,4-227,Yes. 
4508,geco,4-228,Does  it  not  strike  you  as  unlikely  that  a  man  who  had  committed  a  crime  should  keep  the  evidence  of  it  in  an  unlocked  drawer  for  anyone  to  find? 
4509,geco,4-229,He  might  have  stowed  them  there  in  a  hurry. 
4510,geco,4-230,But  you  have  just  said  it  was  a  whole  week  since  the  crime. 
4511,geco,4-231,He  would  have  had  ample  time  to  remove  them  and  destroy  them. 
4512,geco,4-232,Perhaps. 
4513,geco,4-233,There  is  no  perhaps  about  it. 
4514,geco,4-234,"Would  he,  or  would  he  not  have  had  plenty  of  time  to  remove  and  destroy  them? "
4515,geco,4-235,Yes. 
4516,geco,4-236,Was  the  pile  of  underclothes  under  which  the  things  were  hidden  heavy  or  light? 
4517,geco,4-237,Heavyish. 
4518,geco,4-238,"In  other  words,  it  was  winter  underclothing. "
4519,geco,4-239,"Obviously,  the  prisoner  would  not  be  likely  to  go  to  that  drawer? "
4520,geco,4-240,Perhaps  not. 
4521,geco,4-241,Kindly  answer  my  question. 
4522,geco,4-242,"Would  the  prisoner,  in  the  hottest  week  of  a  hot  summer,  be  likely  to  go  to  a  drawer  containing  winter  underclothing. "
4523,geco,4-243,"Yes,  or  no? "
4524,geco,4-244,No. 
4525,geco,4-245,"In  that  case,  is  it  not  possible  that  the  articles  in  question  might  have  been  put  there  by  a  third  person,  and  that  the  prisoner  was  quite  unaware  of  their  presence? "
4526,geco,4-246,I  should  not  think  it  likely. 
4527,geco,4-247,But  it  is  possible? 
4528,geco,4-248,Yes. 
4529,geco,4-249,That  is  all. 
4530,geco,4-250,More  evidence  followed. 
4531,geco,4-251,Evidence  as  to  the  financial  difficulties  in  which  the  prisoner  had  found  himself  at  the  end  of  July. 
4532,geco,4-252,"Evidence  as  to  his  intrigue  with  Mr.s.  Raikes...poor  Mary,  that  must  have  been  bitter  hearing  for  a  woman  of  her  pride. "
4533,geco,4-253,"Evelyn  Howard  had  been  right  in  her  facts,  though  her  animosity  against  Alfred  Inglethorp  had  caused  her  to  jump  to  the  conclusion  that  he  was  the  person  concerned. "
4534,geco,4-254,Lawrence  Cavendish  was  then  put  into  the  box. 
4535,geco,4-255,"In  a  low  voice,  in  answer  to  Mr.  Philips'  questions,  he  denied  having  ordered  anything  from  Parkson's  in  June. "
4536,geco,4-256,"In  fact,  on  June  29th,  he  had  been  staying  away,  in  Wales. "
4537,geco,4-257,"Instantly,  Sir  Ernest's  chin  was  shooting  pugnaciously  forward. "
4538,geco,4-258,You  deny  having  ordered  a  black  beard  from  Parkson's  on  June  29th? 
4539,geco,4-259,I  do. 
4540,geco,4-260,Ah! 
4541,geco,4-261,"In  the  event  of  anything  happening  to  your  brother,  who  will  inherit  Styles  Court? "
4542,geco,4-262,The  brutality  of  the  question  called  a  flush  to  Lawrence's  pale  face. 
4543,geco,4-263,"The  judge  gave  vent  to  a  faint  murmur  of  disapprobation,  and  the  prisoner  in  the  dock  leant  forward  angrily. "
4544,geco,4-264,Heavywether  cared  nothing  for  his  client's  anger. 
4545,geco,4-265,"Answer  my  question,  if  you  please. "
4546,geco,4-266,"I  suppose,  said  Lawrence  quietly,  that  I  should. "
4547,geco,4-267,What  do  you  mean  by  you  'suppose'? 
4548,geco,4-268,Your  brother  has  no  children. 
4549,geco,4-269,"You  would  inherit  it,  wouldn't  you? "
4550,geco,4-270,Yes. 
4551,geco,4-271,"Ah,  that's  better,  said  Heavywether,  with  ferocious  geniality. "
4552,geco,4-272,"And  you'd  inherit  a  good  slice  of  money  too,  wouldn't  you? "
4553,geco,4-273,"Really,  Sir  Ernest,  protested  the  judge,  these  questions  are  not  relevant. "
4554,geco,4-274,"Sir  Ernest  bowed,  and  having  shot  his  arrow  proceeded. "
4555,geco,4-275,"On  Tuesday,  the  17th  July,  you  went,  I  believe,  with  another  guest,  to  visit  the  dispensary  at  the  Red  Cross  Hospital  in  Tadminster? "
4556,geco,4-276,Yes. 
4557,geco,4-277,"Did  you,  while  you  happened  to  be  alone  for  a  few  seconds,  unlock  the  poison  cupboard,  and  examine  some  of  the  bottles? "
4558,geco,4-278,I...I...may  have  done  so. 
4559,geco,4-279,I  put  it  to  you  that  you  did  do  so? 
4560,geco,4-280,Yes. 
4561,geco,4-281,Sir  Ernest  fairly  shot  the  next  question  at  him. 
4562,geco,4-282,Did  you  examine  one  bottle  in  particular? 
4563,geco,4-283,"No,  I  do  not  think  so. "
4564,geco,4-284,"Be  careful,  Mr.  Cavendish. "
4565,geco,4-285,I  am  referring  to  a  little  bottle  of  Hydro-chloride  Hydro-chloride  of  Strychnine. 
4566,geco,4-286,Lawrence  was  turning  a  sickly  greenish  colour. 
4567,geco,4-287,N...o...I  N...o...I  am  sure  I  didn't. 
4568,geco,4-288,Then  how  do  you  account  for  the  fact  that  you  left  the  unmistakable  impress  of  your  finger-prints  on  it? 
4569,geco,4-289,The  bullying  manner  was  highly  efficacious  with  a  nervous  disposition. 
4570,geco,4-290,I...I  suppose  I  must  have  taken  up  the  bottle. 
4571,geco,4-291,I  suppose  so  too! 
4572,geco,4-292,Did  you  abstract  any  of  the  contents  of  the  bottle? 
4573,geco,4-293,Certainly  not. 
4574,geco,4-294,Then  why  did  you  take  it  up? 
4575,geco,4-295,I  once  studied  to  be  a  doctor. 
4576,geco,4-296,Such  things  naturally  interest  me. 
4577,geco,4-297,Ah! 
4578,geco,4-298,"So  poisons  'naturally  interest'  you,  do  they? "
4579,geco,4-299,"Still,  you  waited  to  be  alone  before  gratifying  that  'interest'  of  yours? "
4580,geco,4-300,That  was  pure  chance. 
4581,geco,4-301,"If  the  others  had  been  there,  I  should  have  done  just  the  same. "
4582,geco,4-302,"Still,  as  it  happens,  the  others  were  not  there? "
4583,geco,4-303,"No,  but...... "
4584,geco,4-304,"In fact,  during  the  whole  afternoon,  you  were  only  alone  for  a  couple  of  minutes,  and  it  happened...I  say,  it  happened...to  be  during  those  two  minutes  that  you  displayed  your  'natural  interest'  in  Hydro-chloride  of  Strychnine? "
4585,geco,4-305,Lawrence  stammered  pitiably. 
4586,geco,4-306,I...I...... 
4587,geco,4-307,"With a  satisfied  and  expressive  countenance,  Sir  Ernest  observed:  I  have  nothing  more  to  ask  you,  Mr.  Cavendish. "
4588,geco,4-308,This  bit  of  cross-examination  cross-examination  had  caused  great  excitement  in  court. 
4589,geco,4-309,"The  heads  of  the  many  fashionably  attired  women  present  were  busily  laid  together,  and  their  whispers  became  so  loud  that  the  judge  angrily  threatened  to  have  the  court  cleared  if  there  was  not  immediate  silence. "
4590,geco,4-310,There  was  little  more  evidence. 
4591,geco,4-311,The  hand-writing  experts  were  called  upon  for  their  opinion  of  the  signature  of  'Alfred  Inglethorp'  in  the  chemist's  poison  register. 
4592,geco,4-312,"They  all  declared  unanimously  that  it  was  certainly  not  his  hand-writing,  and  gave  it  as  their  view  that  it  might  be  that  of  the  prisoner  disguised. "
4593,geco,4-313,"Cross-examined,  they  admitted  that  it  might  be  the  prisoner's  hand-writing  cleverly  counterfeited. "
4594,geco,4-314,"Sir  Ernest  Heavywether's  speech  in  opening  the  case  for  the  defence  was  not  a  long  one,  but  it  was  backed  by  the  full  force  of  his  emphatic  manner. "
4595,geco,4-315,"Never,  he  said,  in  the  course  of  his  long  experience,  had  he  known  a  charge  of  murder  rest  on  slighter  evidence. "
4596,geco,4-316,"Not  only  was  it  entirely  circumstantial,  but  the  greater  part  of  it  was  practically  unproved. "
4597,geco,4-317,Let  them  take  the  testimony  they  had  heard  and  sift  it  impartially. 
4598,geco,4-318,The  strychnine  had  been  found  in  a  drawer  in  the  prisoner's  room. 
4599,geco,4-319,"That  drawer  was  an  unlocked  one,  as  he  had  pointed  out,  and  he  submitted  that  there  was  no  evidence  to  prove  that  it  was  the  prisoner  who  had  concealed  the  poison  there. "
4600,geco,4-320,"It  was,  in  fact,  a  wicked  and  malicious  attempt  on  the  part  of  some  third  person  to  fix  the  crime  on  the  prisoner. "
4601,geco,4-321,The  prosecution  had  been  unable  to  produce  a  shred  of  evidence  in  support  of  their  contention  that  it  was  the  prisoner  who  ordered  the  black  beard  from  Parkson's. 
4602,geco,4-322,"The  quarrel  which  had  taken  place  between  prisoner  and  his  stepmother  was  freely  admitted,  but  both  it  and  his  financial  embarrassments  had  been  grossly  exaggerated. "
4603,geco,4-323,"His  learned  friend,  Sir  Ernest  nodded  carelessly  at  Mr.  Philips,  had  stated  that  if  the  prisoner  were  an  innocent  man,  he  would  have  come  forward  at  the  inquest  to  explain  that  it  was  he,  and  not  Mr.  Inglethorp,  who  had  been  the  participator  in  the  quarrel. "
4604,geco,4-324,He  thought  the  facts  had  been  misrepresented. 
4605,geco,4-325,What  had  actually  occurred  was  this. 
